{
    "id": "https://example.com/credentials/1872",
    "type": ["VerifiablePresentation"],
    "verifiableCredential": ["https://example.com/credentials/1872"],
    "proof": {
        "type": "RsaSignature2018",
        "created": "2020-04-22T10:37:22Z",
        "proofPurpose": "assertionMethod",
        "verificationMethod": "https://example.com/keys/1",
        "jws": "eyJhbGciOiJFUzI1NiIsInR5cCI6IkpXVCJ9..."
    }
}
